{
  "version": "2.0",
  "projects": [
    {
      "id": "demo",
      "name": "Demo",
      "wizardCompleted": true,
      "graphReadyModalShown": true,
      "repos": [{ "name": "demo-api", "path": "./repos/demo-api", "type": "backend" }]
    }
  ],
  "output": { "dir": "./coredoc-output", "format": "json", "prettyPrint": true },
  "parserStorage": "./coredoc-parsers",
  "exclude": ["**/node_modules/**", "**/dist/**"]
}
