{
  "version": "2.0",
  "projects": [
    {
      "id": "demo",
      "name": "Demo",
      "wizardCompleted": true,
      "repos": [{ "name": "demo-api", "path": "./repos/demo-api", "type": "backend" }],
      "cloud": {
        "enabled": true,
        "workspaceId": "ws_e2e_demo",
        "lastSyncedAt": "2026-01-01T00:00:00.000Z"
      }
    }
  ],
  "output": { "dir": "./coredoc-output", "format": "json", "prettyPrint": true },
  "parserStorage": "./coredoc-parsers",
  "exclude": ["**/node_modules/**", "**/dist/**"]
}
